{
  "files": [
    {
      "path": "java-ecosystem/libs/analysis-api/src/main/java/module-info.java",
      "sha256": "7e69b8e10003beb8e3dcb48513f162bafe02492489989352ca469bff13748f97"
    },
    {
      "path": "java-ecosystem/libs/analysis-api/src/main/java/org/rostilos/codecrow/analysisapi/rag/RagOperationsService.java",
      "sha256": "137b6772c104b3b377b5ff84ae84a874cff1a411d304ea7c55a8ffc17d4a33d5"
    },
    {
      "path": "java-ecosystem/libs/analysis-engine/src/main/java/module-info.java",
      "sha256": "932ed4d4073d9bd203a6ceab72cc0ef4b8f518da203bbf719858a52d168f0cc8"
    },
    {
      "path": "java-ecosystem/libs/analysis-engine/src/main/java/org/rostilos/codecrow/analysisengine/aiclient/AiAnalysisClient.java",
      "sha256": "a6795552a7d95e927f467fc6f69fd138e8fd883022294ca38e4d7493c92049dd"
    },
    {
      "path": "java-ecosystem/libs/analysis-engine/src/main/java/org/rostilos/codecrow/analysisengine/aiclient/AiCommandClient.java",
      "sha256": "ac21cc4cf6cfe250a34c20802fc7cff0ada95972b56e7335e920b5b486472754"
    },
    {
      "path": "java-ecosystem/libs/analysis-engine/src/main/java/org/rostilos/codecrow/analysisengine/config/RestTemplateConfiguration.java",
      "sha256": "efaa74d688c9f4fdd9e97ee843fb39ecd2557a833bc9a463145f56113c74461f"
    },
    {
      "path": "java-ecosystem/libs/analysis-engine/src/main/java/org/rostilos/codecrow/analysisengine/dto/request/ai/AiAnalysisRequest.java",
      "sha256": "70d88abe7601b6be27af7c5114efd187695624e77552367bf7d67ac46a727c05"
    },
    {
      "path": "java-ecosystem/libs/analysis-engine/src/main/java/org/rostilos/codecrow/analysisengine/dto/request/ai/AiAnalysisRequestImpl.java",
      "sha256": "3b40dc9491a2884ae890ed861ecbce768eb9c0492125c3cee4622b0d8f06519c"
    },
    {
      "path": "java-ecosystem/libs/analysis-engine/src/main/java/org/rostilos/codecrow/analysisengine/dto/request/ai/AiRequestPreviousIssueDTO.java",
      "sha256": "7a473008b4759abff05c2a1e28a75200f1185f3d4a34d369de747ae3cfb4cae0"
    },
    {
      "path": "java-ecosystem/libs/analysis-engine/src/main/java/org/rostilos/codecrow/analysisengine/dto/request/ai/enrichment/FileContentDto.java",
      "sha256": "b73929de5ad47be2c28a491fb51cd4027fdef4cdb79727c974d26605fad30f90"
    },
    {
      "path": "java-ecosystem/libs/analysis-engine/src/main/java/org/rostilos/codecrow/analysisengine/dto/request/ai/enrichment/FileRelationshipDto.java",
      "sha256": "c1504ad0f04f44688cf2bc0d94b7eed9ca38cb79bfaa86e742430f8c7a5a5313"
    },
    {
      "path": "java-ecosystem/libs/analysis-engine/src/main/java/org/rostilos/codecrow/analysisengine/dto/request/ai/enrichment/ParsedFileMetadataDto.java",
      "sha256": "7a036b0290b750ffcf5d213a877824cee3152c10b157714f486e2bc2028e06f5"
    },
    {
      "path": "java-ecosystem/libs/analysis-engine/src/main/java/org/rostilos/codecrow/analysisengine/dto/request/ai/enrichment/PrEnrichmentDataDto.java",
      "sha256": "55b5af75e76eed02dc9657d9c66f3ff009466c9e5dea7570146c58af4d797675"
    },
    {
      "path": "java-ecosystem/libs/analysis-engine/src/main/java/org/rostilos/codecrow/analysisengine/dto/request/processor/AnalysisProcessRequest.java",
      "sha256": "6c4ffd6c84e39ece14e5b1a403f0f5e867d87a8acfad7d69a62a15a674ce0490"
    },
    {
      "path": "java-ecosystem/libs/analysis-engine/src/main/java/org/rostilos/codecrow/analysisengine/dto/request/processor/BranchProcessRequest.java",
      "sha256": "74c681ba300d19f38e9b09edae763c097c00c155f1ee6d52881bd97b216097ab"
    },
    {
      "path": "java-ecosystem/libs/analysis-engine/src/main/java/org/rostilos/codecrow/analysisengine/dto/request/processor/PrProcessRequest.java",
      "sha256": "313d068a74fddc65d69e7b37e7f85b2b52978fa3aad359f966122409a23fef42"
    },
    {
      "path": "java-ecosystem/libs/analysis-engine/src/main/java/org/rostilos/codecrow/analysisengine/dto/request/validation/ValidWebhookRequest.java",
      "sha256": "e56f7e757a6024736d9e35c7bee6dbdb9148bcf9591c2bdfc8fcde0f601224ab"
    },
    {
      "path": "java-ecosystem/libs/analysis-engine/src/main/java/org/rostilos/codecrow/analysisengine/dto/request/validation/WebhookRequestValidator.java",
      "sha256": "86c704d66602883c03c5c0c246bf61d7549cbd62592f745aa7e3867a91253432"
    },
    {
      "path": "java-ecosystem/libs/analysis-engine/src/main/java/org/rostilos/codecrow/analysisengine/exception/AnalysisLockedException.java",
      "sha256": "4e5015e0f4df7f8e9a2d40ae1931eac8f833f8076810515f5ad2cf5003525a69"
    },
    {
      "path": "java-ecosystem/libs/analysis-engine/src/main/java/org/rostilos/codecrow/analysisengine/exception/DiffTooLargeException.java",
      "sha256": "bcaa0f8fa039698644312c9d8261e87d69e920cd57270b08bd68021133b11290"
    },
    {
      "path": "java-ecosystem/libs/analysis-engine/src/main/java/org/rostilos/codecrow/analysisengine/processor/EventConsumer.java",
      "sha256": "778eb2620c4f9b2e982ac09f70f9afe3381cde8ea2b7d05d84026d862f10a7a1"
    },
    {
      "path": "java-ecosystem/libs/analysis-engine/src/main/java/org/rostilos/codecrow/analysisengine/processor/VcsRepoInfoImpl.java",
      "sha256": "66cd28e79ce22e06f802ecfd03c1ec030f310a5c342173d9ea77a547aa55c867"
    },
    {
      "path": "java-ecosystem/libs/analysis-engine/src/main/java/org/rostilos/codecrow/analysisengine/processor/analysis/BranchAnalysisProcessor.java",
      "sha256": "10be4887e8db81af7bf3e018f4624fcae9e780516a3f2af09f9f429cfbe03eac"
    },
    {
      "path": "java-ecosystem/libs/analysis-engine/src/main/java/org/rostilos/codecrow/analysisengine/processor/analysis/PullRequestAnalysisProcessor.java",
      "sha256": "aa110dcec8b3cd2a433bf408a0dfdb62f7e7468a3cc343546c4f015c3bdd634d"
    },
    {
      "path": "java-ecosystem/libs/analysis-engine/src/main/java/org/rostilos/codecrow/analysisengine/service/AnalysisLockService.java",
      "sha256": "88e0018262e9798d666cb8415d73ba27539adbad3c3763e00da21709072ea090"
    },
    {
      "path": "java-ecosystem/libs/analysis-engine/src/main/java/org/rostilos/codecrow/analysisengine/service/AstScopeEnricher.java",
      "sha256": "f4509ca4520a8d30c9dbf2d2ef4fc085446d2f994b834af403c7722a1ca0cfdc"
    },
    {
      "path": "java-ecosystem/libs/analysis-engine/src/main/java/org/rostilos/codecrow/analysisengine/service/BranchArchiveService.java",
      "sha256": "77b19eaa783b6ee033dcc66d0fa00e01ac9de3cfa896b793140ef269bf648200"
    },
    {
      "path": "java-ecosystem/libs/analysis-engine/src/main/java/org/rostilos/codecrow/analysisengine/service/IssueReconcileService.java",
      "sha256": "9f53b8cdafb25d8fe41e07f4e9599b9858001317b8e8fa50766760e3f0b59f58"
    },
    {
      "path": "java-ecosystem/libs/analysis-engine/src/main/java/org/rostilos/codecrow/analysisengine/service/IssueReconciliationEngine.java",
      "sha256": "828eea2cdab6f69723e90dc1c8a36fa890e210f9bbe29791b79902467dcc70b4"
    },
    {
      "path": "java-ecosystem/libs/analysis-engine/src/main/java/org/rostilos/codecrow/analysisengine/service/ProjectValidationService.java",
      "sha256": "a7db6e6f632c9648d428a217441d687fe2f9bea452e2d315bf6f60bf8b9673eb"
    },
    {
      "path": "java-ecosystem/libs/analysis-engine/src/main/java/org/rostilos/codecrow/analysisengine/service/PromptSanitizationService.java",
      "sha256": "77a941e4d073bc0fddebed71f55e68b08eba23ee2976374f9b007bf766553853"
    },
    {
      "path": "java-ecosystem/libs/analysis-engine/src/main/java/org/rostilos/codecrow/analysisengine/service/PullRequestService.java",
      "sha256": "d3b76061506a37dc544822a20e49b5bcd87e5ef0b5564ec18292f07481b97019"
    },
    {
      "path": "java-ecosystem/libs/analysis-engine/src/main/java/org/rostilos/codecrow/analysisengine/service/PullRequestStatusSyncService.java",
      "sha256": "0e4d3f2231398ff9e1ebcf0ae6115b42f861cd8176d80ebc492041a68fef7694"
    },
    {
      "path": "java-ecosystem/libs/analysis-engine/src/main/java/org/rostilos/codecrow/analysisengine/service/branch/BranchAnalysisGateService.java",
      "sha256": "50a31113bd17d0d7eb71cb2ce61fa02b013596cfedf420f6e35992ca4f802de0"
    },
    {
      "path": "java-ecosystem/libs/analysis-engine/src/main/java/org/rostilos/codecrow/analysisengine/service/branch/BranchDiffFetcher.java",
      "sha256": "8d964d8d03d96ef6fe3654d6e5b68ae2a5307eed9f6d7278c5225b9fcf99e9ce"
    },
    {
      "path": "java-ecosystem/libs/analysis-engine/src/main/java/org/rostilos/codecrow/analysisengine/service/branch/BranchFileOperationsService.java",
      "sha256": "8e88c3e495a4d30caac6531b4a38a4ac4295d35a405423b8204dc63c6a829ff1"
    },
    {
      "path": "java-ecosystem/libs/analysis-engine/src/main/java/org/rostilos/codecrow/analysisengine/service/branch/BranchFullReconciliationService.java",
      "sha256": "2127a7586bbb7b657a404541697084daae8a800f93f8025e4c76a35cad1d85d3"
    },
    {
      "path": "java-ecosystem/libs/analysis-engine/src/main/java/org/rostilos/codecrow/analysisengine/service/branch/BranchHealthService.java",
      "sha256": "bea4db894358b1acbee7a1dc479d0502a9f9fb7238a3fc3d74f68ac59da0b310"
    },
    {
      "path": "java-ecosystem/libs/analysis-engine/src/main/java/org/rostilos/codecrow/analysisengine/service/branch/BranchIssueMappingService.java",
      "sha256": "404c661761f73ff4bd18f6fabd5330455858a28fbcacc37ae00f5ce63e22686f"
    },
    {
      "path": "java-ecosystem/libs/analysis-engine/src/main/java/org/rostilos/codecrow/analysisengine/service/branch/BranchIssueReconciliationService.java",
      "sha256": "b7da154b1736f5456df35bc128d0fc3f0b34c78f963902a4919e84da5a07233c"
    },
    {
      "path": "java-ecosystem/libs/analysis-engine/src/main/java/org/rostilos/codecrow/analysisengine/service/pr/PrFileEnrichmentService.java",
      "sha256": "98c60ccdaed8fe0a151cd259852e75550de91452a1d98172cc870445fef4cec6"
    },
    {
      "path": "java-ecosystem/libs/analysis-engine/src/main/java/org/rostilos/codecrow/analysisengine/service/pr/PrIssueTrackingService.java",